mysql> create database payrollService;
Query OK, 1 row affected (0.01 sec)

mysql> show databases;
+--------------------+
| Database           |
+--------------------+
| addressbookservice |
| basics             |
| fundamental        |
| fundamentals       |
| information_schema |
| mysql              |
| payrollservice     |
| performance_schema |
| sys                |
| user_details       |
+--------------------+
10 rows in set (0.00 sec)

mysql>
-------------------------------UC2----------------------------------------------------------------

mysql> use payrollservice;
Database changed
mysql> create table employee_payroll;
ERROR 4028 (HY000): A table must have at least one visible column.
mysql> create table employee_payroll
    -> (employee_id int(15),
    -> name varchar(30),
    -> salary double(10,2),
    -> start_date DATE,
    -> primary key(employee_id)
    -> );
Query OK, 0 rows affected, 2 warnings (0.03 sec)

mysql> show table;
ERROR 1064 (42000): You have an error in your SQL syntax; check the manual that corresponds to your MySQL server version for the right syntax to use near '' at line 1
mysql> describe employee_payroll;
+-------------+--------------+------+-----+---------+-------+
| Field       | Type         | Null | Key | Default | Extra |
+-------------+--------------+------+-----+---------+-------+
| employee_id | int          | NO   | PRI | NULL    |       |
| name        | varchar(30)  | YES  |     | NULL    |       |
| salary      | double(10,2) | YES  |     | NULL    |       |
| start_date  | date         | YES  |     | NULL    |       |
+-------------+--------------+------+-----+---------+-------+
4 rows in set (0.00 sec)

mysql>
------------------------------------------UC3------------------------------------------------------

mysql> insert into employee_payroll( employee_id,name,salary,start_date) VALUES (1,'krishna',35000,'2019-04-15'),(2,'raj',48000,'2020-12-09'),(3,'abhijit',56000,'2022-04-25');
Query OK, 3 rows affected (0.01 sec)
Records: 3  Duplicates: 0  Warnings: 0

mysql> select * from  employee_payroll;
+-------------+---------+----------+------------+
| employee_id | name    | salary   | start_date |
+-------------+---------+----------+------------+
|           1 | krishna | 35000.00 | 2019-04-15 |
|           2 | raj     | 48000.00 | 2020-12-09 |
|           3 | abhijit | 56000.00 | 2022-04-25 |
+-------------+---------+----------+------------+
3 rows in set (0.00 sec)

mysql>
-----------------------------------------UC4------------------------------------------------------
mysql> select * from  employee_payroll;
+-------------+---------+----------+------------+
| employee_id | name    | salary   | start_date |
+-------------+---------+----------+------------+
|           1 | krishna | 35000.00 | 2019-04-15 |
|           2 | raj     | 48000.00 | 2020-12-09 |
|           3 | abhijit | 56000.00 | 2022-04-25 |
+-------------+---------+----------+------------+
3 rows in set (0.00 sec)

mysql>
-----------------------------------------UC5------------------------------------------------------

mysql> select salary from employee_payroll where name='raj';
+----------+
| salary   |
+----------+
| 48000.00 |
+----------+
1 row in set (0.00 sec)

mysql> select * from employee_payroll
    -> WHERE start_date BETWEEN CAST('2019-04-15' AS DATE) AND DATE(NOW());
+-------------+---------+----------+------------+
| employee_id | name    | salary   | start_date |
+-------------+---------+----------+------------+
|           1 | krishna | 35000.00 | 2019-04-15 |
|           2 | raj     | 48000.00 | 2020-12-09 |
|           3 | abhijit | 56000.00 | 2022-04-25 |
+-------------+---------+----------+------------+
3 rows in set (0.00 sec)

mysql>
----------------------------------------UC6-----------------------------------------------------

mysql> alter table employee_payroll add gender varchar(5);
Query OK, 0 rows affected (0.02 sec)
Records: 0  Duplicates: 0  Warnings: 0
mysql> select * from employee_payroll;
+-------------+---------+----------+------------+--------+
| employee_id | name    | salary   | start_date | gender |
+-------------+---------+----------+------------+--------+
|           1 | krishna | 35000.00 | 2019-04-15 | NULL   |
|           2 | raj     | 48000.00 | 2020-12-09 | NULL   |
|           3 | abhijit | 56000.00 | 2022-04-25 | NULL   |
+-------------+---------+----------+------------+--------+
3 rows in set (0.00 sec)
mysql> update employee_payroll set gender = 'M' WHERE name = 'krishna' or name = 'raj';
Query OK, 2 rows affected (0.01 sec)
Rows matched: 2  Changed: 2  Warnings: 0

mysql> update employee_payroll set gender = 'F' WHERE name = 'abhijit';
Query OK, 1 row affected (0.00 sec)
Rows matched: 1  Changed: 1  Warnings: 0

mysql> select * from employee_payroll;
+-------------+---------+----------+------------+--------+
| employee_id | name    | salary   | start_date | gender |
+-------------+---------+----------+------------+--------+
|           1 | krishna | 35000.00 | 2019-04-15 | M      |
|           2 | raj     | 48000.00 | 2020-12-09 | M      |
|           3 | abhijit | 56000.00 | 2022-04-25 | F      |
+-------------+---------+----------+------------+--------+
3 rows in set (0.00 sec)

mysql>
-----------------------------------UC7-------------------------------------------------------------

mysql> SELECT SUM(salary) FROM employee_payroll
    -> WHERE gender = 'F' GROUP BY gender;
+-------------+
| SUM(salary) |
+-------------+
|    56000.00 |
+-------------+
1 row in set (0.00 sec)

mysql>  SELECT SUM(salary) FROM employee_payroll
    ->  WHERE gender = 'M' GROUP BY gender;
+-------------+
| SUM(salary) |
+-------------+
|    83000.00 |
+-------------+
1 row in set (0.00 sec)

mysql> SELECT AVG(salary) from employee_payroll
    -> where gender = 'F' GROUP BY gender;
+--------------+
| AVG(salary)  |
+--------------+
| 56000.000000 |
+--------------+
1 row in set (0.00 sec)

mysql> SELECT AVG(salary) from employee_payroll
    ->  where gender = 'M' GROUP BY gender;
+--------------+
| AVG(salary)  |
+--------------+
| 41500.000000 |
+--------------+
1 row in set (0.00 sec)

mysql> SELECT MIN(salary) from  from employee_payroll
    ->   where gender = 'M' GROUP BY gender;
ERROR 1064 (42000): You have an error in your SQL syntax; check the manual that corresponds to your MySQL server version for the right syntax to use near 'from employee_payroll
  where gender = 'M' GROUP BY gender' at line 1
mysql> select min(salary) from employee_payroll
    ->  where gender = 'M' GROUP BY gender;
+-------------+
| min(salary) |
+-------------+
|    35000.00 |
+-------------+
1 row in set (0.00 sec)

mysql> select max(salary)  from employee_payroll
    ->  where gender = 'M' GROUP BY gender;
+-------------+
| max(salary) |
+-------------+
|    48000.00 |
+-------------+
1 row in set (0.00 sec)

mysql>
------------------------------------UC8----------------------------------------------------------

mysql>  alter table employee_payroll add (phone int(15), address varchar(20), department varchar(15));
Query OK, 0 rows affected, 1 warning (0.01 sec)
Records: 0  Duplicates: 0  Warnings: 1

mysql> describe employee_payroll;
+-------------+--------------+------+-----+---------+-------+
| Field       | Type         | Null | Key | Default | Extra |
+-------------+--------------+------+-----+---------+-------+
| employee_id | int          | NO   | PRI | NULL    |       |
| name        | varchar(30)  | YES  |     | NULL    |       |
| salary      | double(10,2) | YES  |     | NULL    |       |
| start_date  | date         | YES  |     | NULL    |       |
| gender      | varchar(5)   | YES  |     | NULL    |       |
| phone       | int          | YES  |     | NULL    |       |
| address     | varchar(20)  | YES  |     | NULL    |       |
| department  | varchar(15)  | YES  |     | NULL    |       |
+-------------+--------------+------+-----+---------+-------+
8 rows in set (0.00 sec)