mysql> create database payrollService;
Query OK, 1 row affected (0.01 sec)

mysql> show databases;
+--------------------+
| Database           |
+--------------------+
| addressbookservice |
| basics             |
| fundamental        |
| fundamentals       |
| information_schema |
| mysql              |
| payrollservice     |
| performance_schema |
| sys                |
| user_details       |
+--------------------+
10 rows in set (0.00 sec)

mysql>
-------------------------------UC2----------------------------------------------------------------

mysql> use payrollservice;
Database changed
mysql> create table employee_payroll;
ERROR 4028 (HY000): A table must have at least one visible column.
mysql> create table employee_payroll
    -> (employee_id int(15),
    -> name varchar(30),
    -> salary double(10,2),
    -> start_date DATE,
    -> primary key(employee_id)
    -> );
Query OK, 0 rows affected, 2 warnings (0.03 sec)

mysql> show table;
ERROR 1064 (42000): You have an error in your SQL syntax; check the manual that corresponds to your MySQL server version for the right syntax to use near '' at line 1
mysql> describe employee_payroll;
+-------------+--------------+------+-----+---------+-------+
| Field       | Type         | Null | Key | Default | Extra |
+-------------+--------------+------+-----+---------+-------+
| employee_id | int          | NO   | PRI | NULL    |       |
| name        | varchar(30)  | YES  |     | NULL    |       |
| salary      | double(10,2) | YES  |     | NULL    |       |
| start_date  | date         | YES  |     | NULL    |       |
+-------------+--------------+------+-----+---------+-------+
4 rows in set (0.00 sec)

mysql>
------------------------------------------UC3------------------------------------------------------

mysql> insert into employee_payroll( employee_id,name,salary,start_date) VALUES (1,'krishna',35000,'2019-04-15'),(2,'raj',48000,'2020-12-09'),(3,'abhijit',56000,'2022-04-25');
Query OK, 3 rows affected (0.01 sec)
Records: 3  Duplicates: 0  Warnings: 0

mysql> select * from  employee_payroll;
+-------------+---------+----------+------------+
| employee_id | name    | salary   | start_date |
+-------------+---------+----------+------------+
|           1 | krishna | 35000.00 | 2019-04-15 |
|           2 | raj     | 48000.00 | 2020-12-09 |
|           3 | abhijit | 56000.00 | 2022-04-25 |
+-------------+---------+----------+------------+
3 rows in set (0.00 sec)

mysql>
-----------------------------------------UC4------------------------------------------------------
mysql> select * from  employee_payroll;
+-------------+---------+----------+------------+
| employee_id | name    | salary   | start_date |
+-------------+---------+----------+------------+
|           1 | krishna | 35000.00 | 2019-04-15 |
|           2 | raj     | 48000.00 | 2020-12-09 |
|           3 | abhijit | 56000.00 | 2022-04-25 |
+-------------+---------+----------+------------+
3 rows in set (0.00 sec)

mysql>
-----------------------------------------UC5------------------------------------------------------

mysql> select salary from employee_payroll where name='raj';
+----------+
| salary   |
+----------+
| 48000.00 |
+----------+
1 row in set (0.00 sec)

mysql> select * from employee_payroll
    -> WHERE start_date BETWEEN CAST('2019-04-15' AS DATE) AND DATE(NOW());
+-------------+---------+----------+------------+
| employee_id | name    | salary   | start_date |
+-------------+---------+----------+------------+
|           1 | krishna | 35000.00 | 2019-04-15 |
|           2 | raj     | 48000.00 | 2020-12-09 |
|           3 | abhijit | 56000.00 | 2022-04-25 |
+-------------+---------+----------+------------+
3 rows in set (0.00 sec)

mysql>
----------------------------------------UC6-----------------------------------------------------

mysql> alter table employee_payroll add gender varchar(5);
Query OK, 0 rows affected (0.02 sec)
Records: 0  Duplicates: 0  Warnings: 0
mysql> select * from employee_payroll;
+-------------+---------+----------+------------+--------+
| employee_id | name    | salary   | start_date | gender |
+-------------+---------+----------+------------+--------+
|           1 | krishna | 35000.00 | 2019-04-15 | NULL   |
|           2 | raj     | 48000.00 | 2020-12-09 | NULL   |
|           3 | abhijit | 56000.00 | 2022-04-25 | NULL   |
+-------------+---------+----------+------------+--------+
3 rows in set (0.00 sec)
mysql> update employee_payroll set gender = 'M' WHERE name = 'krishna' or name = 'raj';
Query OK, 2 rows affected (0.01 sec)
Rows matched: 2  Changed: 2  Warnings: 0

mysql> update employee_payroll set gender = 'F' WHERE name = 'abhijit';
Query OK, 1 row affected (0.00 sec)
Rows matched: 1  Changed: 1  Warnings: 0

mysql> select * from employee_payroll;
+-------------+---------+----------+------------+--------+
| employee_id | name    | salary   | start_date | gender |
+-------------+---------+----------+------------+--------+
|           1 | krishna | 35000.00 | 2019-04-15 | M      |
|           2 | raj     | 48000.00 | 2020-12-09 | M      |
|           3 | abhijit | 56000.00 | 2022-04-25 | F      |
+-------------+---------+----------+------------+--------+
3 rows in set (0.00 sec)

mysql>
-----------------------------------UC7-------------------------------------------------------------

mysql> SELECT SUM(salary) FROM employee_payroll
    -> WHERE gender = 'F' GROUP BY gender;
+-------------+
| SUM(salary) |
+-------------+
|    56000.00 |
+-------------+
1 row in set (0.00 sec)

mysql>  SELECT SUM(salary) FROM employee_payroll
    ->  WHERE gender = 'M' GROUP BY gender;
+-------------+
| SUM(salary) |
+-------------+
|    83000.00 |
+-------------+
1 row in set (0.00 sec)

mysql> SELECT AVG(salary) from employee_payroll
    -> where gender = 'F' GROUP BY gender;
+--------------+
| AVG(salary)  |
+--------------+
| 56000.000000 |
+--------------+
1 row in set (0.00 sec)

mysql> SELECT AVG(salary) from employee_payroll
    ->  where gender = 'M' GROUP BY gender;
+--------------+
| AVG(salary)  |
+--------------+
| 41500.000000 |
+--------------+
1 row in set (0.00 sec)

mysql> SELECT MIN(salary) from  from employee_payroll
    ->   where gender = 'M' GROUP BY gender;
ERROR 1064 (42000): You have an error in your SQL syntax; check the manual that corresponds to your MySQL server version for the right syntax to use near 'from employee_payroll
  where gender = 'M' GROUP BY gender' at line 1
mysql> select min(salary) from employee_payroll
    ->  where gender = 'M' GROUP BY gender;
    
+-------------+
| min(salary) |
+-------------+
|    35000.00 |
+-------------+
1 row in set (0.00 sec)

mysql> select max(salary)  from employee_payroll
    ->  where gender = 'M' GROUP BY gender;
+-------------+
| max(salary) |
+-------------+
|    48000.00 |
+-------------+
1 row in set (0.00 sec)

mysql>
------------------------------------UC8----------------------------------------------------------

mysql>  alter table employee_payroll add (phone int(15), address varchar(20), department varchar(15));
Query OK, 0 rows affected, 1 warning (0.01 sec)
Records: 0  Duplicates: 0  Warnings: 1

mysql> describe employee_payroll;
+-------------+--------------+------+-----+---------+-------+
| Field       | Type         | Null | Key | Default | Extra |
+-------------+--------------+------+-----+---------+-------+
| employee_id | int          | NO   | PRI | NULL    |       |
| name        | varchar(30)  | YES  |     | NULL    |       |
| salary      | double(10,2) | YES  |     | NULL    |       |
| start_date  | date         | YES  |     | NULL    |       |
| gender      | varchar(5)   | YES  |     | NULL    |       |
| phone       | int          | YES  |     | NULL    |       |
| address     | varchar(20)  | YES  |     | NULL    |       |
| department  | varchar(15)  | YES  |     | NULL    |       |
+-------------+--------------+------+-----+---------+-------+
8 rows in set (0.00 sec)
----------------------------------------------UC9-------------------------------------------------

mysql> alter table employee_payroll add (basic_pay double(10,3),deductions double(8,2), taxable_pay double(9,3), income_tax double(7,2), net_pay double(15,3));
Query OK, 0 rows affected, 5 warnings (0.01 sec)
Records: 0  Duplicates: 0  Warnings: 5

mysql> describe employee_payroll;
+-------------+--------------+------+-----+---------+-------+
| Field       | Type         | Null | Key | Default | Extra |
+-------------+--------------+------+-----+---------+-------+
| employee_id | int          | NO   | PRI | NULL    |       |
| name        | varchar(30)  | YES  |     | NULL    |       |
| salary      | double(10,2) | YES  |     | NULL    |       |
| start_date  | date         | YES  |     | NULL    |       |
| gender      | varchar(5)   | YES  |     | NULL    |       |
| phone       | int          | YES  |     | NULL    |       |
| address     | varchar(20)  | YES  |     | NULL    |       |
| department  | varchar(15)  | YES  |     | NULL    |       |
| basic_pay   | double(10,3) | YES  |     | NULL    |       |
| deductions  | double(8,2)  | YES  |     | NULL    |       |
| taxable_pay | double(9,3)  | YES  |     | NULL    |       |
| income_tax  | double(7,2)  | YES  |     | NULL    |       |
| net_pay     | double(15,3) | YES  |     | NULL    |       |
+-------------+--------------+------+-----+---------+-------+
13 rows in set (0.00 sec)

mysql>
-----------------------------------UC10---------------------------------------------------------

mysql> update employee_payroll SET phone_number = 9866109193, address = 'hyderabad',department = 'HR',basic_pay=40000,deductions=1000,taxable_pay=31000,income_tax=4000,net_pay=31000 where employee_id = 1;
Query OK, 1 row affected (0.01 sec)
Rows matched: 1  Changed: 1  Warnings: 0

mysql>  update employee_payroll SET phone_number = 9493149258, address ='vijayawada',department = 'testing',basic_pay=52000,deductions=1500,taxable_pay=45000,income_tax=5000,net_pay=45000 where employee_id = 2;
Query OK, 1 row affected (0.00 sec)
Rows matched: 1  Changed: 1  Warnings: 0

mysql>  update employee_payroll SET phone_number = 8886968998, address ='guntur',department = 'developer',basic_pay=60000,deductions=2500,taxable_pay=53000,income_tax=5500,net_pay=53000 where employee_id = 3;
Query OK, 1 row affected (0.01 sec)
Rows matched: 1  Changed: 1  Warnings: 0

mysql> select * from employee_payroll;
+-------------+---------+----------+------------+--------+--------------+------------+------------+-----------+------------+-------------+------------+-----------+
| employee_id | name    | salary   | start_date | gender | phone_number | address    | department | basic_pay | deductions | taxable_pay | income_tax | net_pay   |
+-------------+---------+----------+------------+--------+--------------+------------+------------+-----------+------------+-------------+------------+-----------+
|           1 | krishna | 35000.00 | 2019-04-15 | M      |   9866109193 | hyderabad  | HR         | 40000.000 |    1000.00 |   31000.000 |    4000.00 | 31000.000 |
|           2 | raj     | 48000.00 | 2020-12-09 | M      |   9493149258 | vijayawada | testing    | 52000.000 |    1500.00 |   45000.000 |    5000.00 | 45000.000 |
|           3 | abhijit | 56000.00 | 2022-04-25 | F      |   8886968998 | guntur     | developer  | 60000.000 |    2500.00 |   53000.000 |    5500.00 | 53000.000 |
+-------------+---------+----------+------------+--------+--------------+------------+------------+-----------+------------+-------------+------------+-----------+
3 rows in set (0.00 sec)

mysql> insert into employee_payroll values (4,'terissa',38000,2021-05-16,'F',8897361232,'patna','web_developer',43000,1300,34000,4500,34000);
ERROR 1292 (22007): Incorrect date value: '2000' for column 'start_date' at row 1
mysql> ^C
mysql> insert into employee_payroll values (4,'terissa',38000,'2021-05-16','F',8897361232,'patna','web_developer',43000,1300,34000,4500,34000);
Query OK, 1 row affected (0.01 sec)

mysql> insert into employee_payroll values (5,'terissa',80000,'2018-05-16','F',9652030278,'ernakulam','manager',73000,3500,74000,6000,74000);
Query OK, 1 row affected (0.01 sec)

mysql> select * from employee_payroll;
+-------------+---------+----------+------------+--------+--------------+------------+---------------+-----------+------------+-------------+------------+-----------+
| employee_id | name    | salary   | start_date | gender | phone_number | address    | department    | basic_pay | deductions | taxable_pay | income_tax | net_pay   |
+-------------+---------+----------+------------+--------+--------------+------------+---------------+-----------+------------+-------------+------------+-----------+
|           1 | krishna | 35000.00 | 2019-04-15 | M      |   9866109193 | hyderabad  | HR            | 40000.000 |    1000.00 |   31000.000 |    4000.00 | 31000.000 |
|           2 | raj     | 48000.00 | 2020-12-09 | M      |   9493149258 | vijayawada | testing       | 52000.000 |    1500.00 |   45000.000 |    5000.00 | 45000.000 |
|           3 | abhijit | 56000.00 | 2022-04-25 | F      |   8886968998 | guntur     | developer     | 60000.000 |    2500.00 |   53000.000 |    5500.00 | 53000.000 |
|           4 | terissa | 38000.00 | 2021-05-16 | F      |   8897361232 | patna      | web_developer | 43000.000 |    1300.00 |   34000.000 |    4500.00 | 34000.000 |
|           5 | terissa | 80000.00 | 2018-05-16 | F      |   9652030278 | ernakulam  | manager       | 73000.000 |    3500.00 |   74000.000 |    6000.00 | 74000.000 |
+-------------+---------+----------+------------+--------+--------------+------------+---------------+-----------+------------+-------------+------------+-----------+
5 rows in set (0.00 sec)
mysql> update employee_payroll set department = 'sales' where employee_id = 4;
Query OK, 1 row affected (0.00 sec)
Rows matched: 1  Changed: 1  Warnings: 0

mysql> update employee_payroll set department = 'marketing' where employee_id = 5;
Query OK, 1 row affected (0.00 sec)
Rows matched: 1  Changed: 1  Warnings: 0

mysql> select * from employee_payroll;
+-------------+---------+----------+------------+--------+--------------+------------+------------+-----------+------------+-------------+------------+-----------+
| employee_id | name    | salary   | start_date | gender | phone_number | address    | department | basic_pay | deductions | taxable_pay | income_tax | net_pay   |
+-------------+---------+----------+------------+--------+--------------+------------+------------+-----------+------------+-------------+------------+-----------+
|           1 | krishna | 35000.00 | 2019-04-15 | M      |   9866109193 | hyderabad  | HR         | 40000.000 |    1000.00 |   31000.000 |    4000.00 | 31000.000 |
|           2 | raj     | 48000.00 | 2020-12-09 | M      |   9493149258 | vijayawada | testing    | 52000.000 |    1500.00 |   45000.000 |    5000.00 | 45000.000 |
|           3 | abhijit | 56000.00 | 2022-04-25 | F      |   8886968998 | guntur     | developer  | 60000.000 |    2500.00 |   53000.000 |    5500.00 | 53000.000 |
|           4 | terissa | 38000.00 | 2021-05-16 | F      |   8897361232 | patna      | sales      | 43000.000 |    1300.00 |   34000.000 |    4500.00 | 34000.000 |
|           5 | terissa | 80000.00 | 2018-05-16 | F      |   9652030278 | ernakulam  | marketing  | 73000.000 |    3500.00 |   74000.000 |    6000.00 | 74000.000 |
+-------------+---------+----------+------------+--------+--------------+------------+------------+-----------+------------+-------------+------------+-----------+
5 rows in set (0.00 sec)

mysql>
